Product Name ,Category,description,price,expiryDate,quantity,supplier,color,size,country,type,sold,style,perc_alcholas,fermentation,aromas,taste,flavors,recommended,features,subcategoryEcht kriekenbier,Biéres Artisanales,"""Echt Kriekenbier (real cherry beer)"" is, as the name suggests, a cherry beer that is manufactured with only the real fruit of cherries instead of with flavor enhancers or extracts of cherries.",3.1,12/10/17,12,Chez Alan,Fruitie,25cl,Belgique,Brasserie: St feuillien,0,Lambic,0.07,n.a,"Fruits rouges, bois, madère",Acide et non sucrée,"Gibier au vin rouge, tarte frangipane, tarte au sucre",N.a,Light ,CubisFruitessse ,Biéres Artisanales,n.a,2.75,13-10-2018,12,Chez Alan,Fruitie,25cl,Belgique,Brasserie : Des légendes,0,Lambic,0.04,n.a,"Délicieusement doux, avec l'étincelle de champagne et la fraîcheur d'un verre de vin bien glacé",n.a,n.a,n.a,Light ,CubisCuvée des tro lls,Biéres Artisanales,"La Cuvée des Trolls est une bière belge brassée depuis l'an 2000 par la Brasserie Dubuisson qui produit aussi les caractérielles bières Bush.
Elle intègre évidemment tous les critères de qualité des bières de la brasserie Dubuisson, c'est-à-dire un brassage traditionnel, sans aucun additif avec un caractère indéniable. La Cuvée des Trolls est aromatisée avec des écorces d’oranges séchées. Celles-ci sont ajoutées au moût lors de l’ébullition. Elles donnent à cette bière des notes de fraîcheur et des arômes particulièrement agréables et fruités. Au palais, la Cuvée des Trolls présente une rondeur constituée à la fois de goûts et de saveurs assez relevés, mais particulièrement bien équilibrés. L’amertume, l’acidité et le sucré s’équilibrent parfaitement et donne ainsi une bière goûteuse et sans aspérités désagréables.",2.2,14-10-2018,12,Chez Alan,Blonde,25cl,Belgique,Brasserie : Dubuisson,0,Lambic,0.07,Fermentation Haute,"Arômes fruités d'oranges, sensation sucrée",Fruitée et très peu amère,"gratin de macaronis au homard, saint-nectaire, sabayon à l'orange",n.a,Light ,CubisApple  ,Biéres Artisanales,"La Lindemans Apple a vu le jour vers la fin de l'année 2005 à la Brasserie Lindemans, près de Bruxelles. À l'origine, la bière de pomme était une boisson produite par les celtes qu'ils buvaient à l'occasion des fêtes des récoltes. La Brasserie Lindemans s'est inspirée de cette tradition brassicole pour fabriquer une variante de Lambic à base de pomme. Cette Lindemans Apple présente une robe jaune or, surmontée d'une tête de mousse quasiment inexistante.
Elle dégage des arômes prononcés de pomme et de bonbons à la pomme. On retrouve en bouche une forte présence des pommes qui s'accompagne de notes citriques à la très légère acidité équilibrée par des touches de sucre candi. Elle laisse sur la langue un goût de pomme légèrement acidulé. Essayez de la déguster avec un toast de foie gras, vous allez être surpris !",2.2,15-10-2018,12,Chez Alan,Ambrée,25cl,Belgique,Brasserie : Lindemans,0,Lambic,0.04,Fermentation Spontanée,"Douce et sucrée, pointe d'acidité",n.a,"Salades, toasts au foie gras",Médaille de Bronze au Australian International Beer Awards 2014 et Médaille d'Or au World Beer Awards 2013 ,Light ,CubisFramboise ,Biéres Artisanales,"La Lindemans Framboise est une bière aux fruits développée par la Brasserie Lindemans vers la fin des années 70. Elle est obtenue à la suite d'une fermentation spontanée et produite exclusivement dans la région de Bruxelles.
Mûrie et enrichie avec du jus de framboise, elle devient une boisson fraîche et fruitée ! Cette Lindemans Framboise est une bière à la robe rose foncé qui se couvre d'une mousse légèrement rose à la faible persistance dans le verre. Elle laisse échapper de ce verre des arômes puissants de framboises et de caramel, le tout évoquant la tarte aux framboises.",2.2,16-10-2018,12,Chez Alan,Fruitée,25cl,Belgique,Brasserie : Lindemans,0,Lambic,0.03,Fermentation Spontanée,"Douce et sucrée, pointe d'acidité",n.a,"Salade d'endives, apéritif, cheesecake, gâteau au chocolat, framboises",,Light ,CubisKriek,Biéres Artisanales,"Cette Lindemans Kriek est une bière fruitée qui, lors de la production, va bénéficier d'un apport en fruits avant d'être placée en vieillissement dans des fûts de chêne. Cela permet aux fruits d'infuser dans le breuvage et cela entraîne une refermentation de la bière pendant cette période de maturation. Cela donne une bière rouge clair avec une énorme tête de mousse rose.
Le tout est traversé par une effervescence considérable. L'arôme qu'elle laisse s'échapper est très doux et totalement dominé par les odeurs de cerises. En bouche, la saveur est également dominée par les cerises, mais sur un fond boisé et des notes acides. Cette bière est particulièrement appréciée des femmes grâce à sa légèreté et son arôme très fruité. Servir à une température comprise entre 2 et 3°C.",3.2,17-10-2018,12,Chez Alan,Fruitée,25cl,Belgique,Brasserie : Lindemans,0,Lambic,0.04,Fermentation Spontanée,"Douce et sucrée, pointe d'acidité",n.a,"Fromage blanc, terrines, carbonnade Flamande",,Light ,Cubis