product name ,category,description,price,expiryDate,quantity,supplier,color,size,country,type,sold,style,perc_alcholas,fermentation,aromas,taste,flavors,recommended,features,subcategoryEcht kriekenbier,Bi_res Artisanales,"""Echt Kriekenbier (real cherry beer)"" is, as the name suggests, a cherry beer that is manufactured with only the real fruit of cherries instead of with flavor enhancers or extracts of cherries.",3.1,13-10-2018,12,Chez Alan,Fruitie,25cl,Belgique,Brasserie: St feuillien,0,Lambic,0.07,n.a,"Fruits rouges, bois, madre",Acide et non sucr_e,"Gibier au vin rouge, tarte frangipane, tarte au sucre",N.a,Light ,CubisFruitessse ,Bi_res Artisanales,n.a,2.75,13-10-2018,12,Chez Alan,Fruitie,25cl,Belgique,Brasserie : Des l_gendes,0,Lambic,0.04,n.a,"D_licieusement doux, avec l'_tincelle de champagne et la fraÓcheur d'un verre de vin bien glac_",n.a,n.a,n.a,Light ,CubisCuv_e des tro lls,Bi_res Artisanales,"La Cuv_e des Trolls est une bire belge brass_e depuis l'an 2000 par la Brasserie Dubuisson qui produit aussi les caract_rielles bires Bush.Elle intgre _videmment tous les critres de qualit_ des bires de la brasserie Dubuisson, c'est-ö-dire un brassage traditionnel, sans aucun additif avec un caractre ind_niable. La Cuv_e des Trolls est aromatis_e avec des _corces dÍoranges s_ch_es. Celles-ci sont ajout_es au mo_t lors de lÍ_bullition. Elles donnent ö cette bire des notes de fraÓcheur et des arªmes particulirement agr_ables et fruit_s. Au palais, la Cuv_e des Trolls pr_sente une rondeur constitu_e ö la fois de go_ts et de saveurs assez relev_s, mais particulirement bien _quilibr_s. LÍamertume, lÍacidit_ et le sucr_ sÍ_quilibrent parfaitement et donne ainsi une bire go_teuse et sans asp_rit_s d_sagr_ables.",2.2,14-10-2018,12,Chez Alan,Blonde,25cl,Belgique,Brasserie : Dubuisson,0,Lambic,0.07,Fermentation Haute,"Arªmes fruit_s d'oranges, sensation sucr_e",Fruit_e et trs peu amre,"gratin de macaronis au homard, saint-nectaire, sabayon ö l'orange",n.a,Light ,CubisApple  ,Bi_res Artisanales,"La Lindemans Apple a vu le jour vers la fin de l'ann_e 2005 ö la Brasserie Lindemans, prs de Bruxelles. è l'origine, la bire de pomme _tait une boisson produite par les celtes qu'ils buvaient ö l'occasion des ftes des r_coltes. La Brasserie Lindemans s'est inspir_e de cette tradition brassicole pour fabriquer une variante de Lambic ö base de pomme. Cette Lindemans Apple pr_sente une robe jaune or, surmont_e d'une tte de mousse quasiment inexistante.Elle d_gage des arªmes prononc_s de pomme et de bonbons ö la pomme. On retrouve en bouche une forte pr_sence des pommes qui s'accompagne de notes citriques ö la trs l_gre acidit_ _quilibr_e par des touches de sucre candi. Elle laisse sur la langue un go_t de pomme l_grement acidul_. Essayez de la d_guster avec un toast de foie gras, vous allez tre surpris !",2.2,15-10-2018,12,Chez Alan,Ambr_e,25cl,Belgique,Brasserie : Lindemans,0,Lambic,0.04,Fermentation Spontan_e,"Douce et sucr_e, pointe d'acidit_",n.a,"Salades, toasts au foie gras",M_daille de Bronze au Australian International Beer Awards 2014 et M_daille d'Or au World Beer Awards 2013 ,Light ,CubisFramboise ,Bi_res Artisanales,"La Lindemans Framboise est une bire aux fruits d_velopp_e par la Brasserie Lindemans vers la fin des ann_es 70. Elle est obtenue ö la suite d'une fermentation spontan_e et produite exclusivement dans la r_gion de Bruxelles.M_rie et enrichie avec du jus de framboise, elle devient une boisson fraÓche et fruit_e ! Cette Lindemans Framboise est une bire ö la robe rose fonc_ qui se couvre d'une mousse l_grement rose ö la faible persistance dans le verre. Elle laisse _chapper de ce verre des arªmes puissants de framboises et de caramel, le tout _voquant la tarte aux framboises.",2.2,16-10-2018,12,Chez Alan,Fruit_e,25cl,Belgique,Brasserie : Lindemans,0,Lambic,0.03,Fermentation Spontan_e,"Douce et sucr_e, pointe d'acidit_",n.a,"Salade d'endives, ap_ritif, cheesecake, gäteau au chocolat, framboises",,Light ,CubisKriek,Bi_res Artisanales,"Cette Lindemans Kriek est une bire fruit_e qui, lors de la production, va b_n_ficier d'un apport en fruits avant d'tre plac_e en vieillissement dans des f_ts de chne. Cela permet aux fruits d'infuser dans le breuvage et cela entraÓne une refermentation de la bire pendant cette p_riode de maturation. Cela donne une bire rouge clair avec une _norme tte de mousse rose.Le tout est travers_ par une effervescence consid_rable. L'arªme qu'elle laisse s'_chapper est trs doux et totalement domin_ par les odeurs de cerises. En bouche, la saveur est _galement domin_e par les cerises, mais sur un fond bois_ et des notes acides. Cette bire est particulirement appr_ci_e des femmes gräce ö sa l_gret_ et son arªme trs fruit_. Servir ö une temp_rature comprise entre 2 et 3ÁC.",3.2,17-10-2018,12,Chez Alan,Fruit_e,25cl,Belgique,Brasserie : Lindemans,0,Lambic,0.04,Fermentation Spontan_e,"Douce et sucr_e, pointe d'acidit_",n.a,"Fromage blanc, terrines, carbonnade Flamande",,Light ,Cubis